{
  "schemaVersion": "1.0",
  "generatedAt": "2026-08-12T10:56:37.142Z",
  "proofdiff": {
    "commit": "a9b721ca7500da4b316c737dbb159ded6e6d3577",
    "version": "0.1.0"
  },
  "environment": {
    "platform": "darwin",
    "architecture": "arm64",
    "node": "v24.15.0",
    "cpuModel": "Apple M3",
    "cpuCount": 8,
    "memoryGiB": 16
  },
  "cases": [
    {
      "id": "p-map-root-test-file",
      "repository": "sindresorhus/p-map",
      "commit": "bc26cf03f81292325236a1188063dac8e7a4de0f",
      "changeType": "real-repository-structure+synthetic-no-op",
      "evaluationMode": "static-only",
      "durationMs": 176,
      "inventory": {
        "trackedFiles": 15,
        "manifestTrackedFiles": 15,
        "inventoryFiles": 15,
        "supportedSourceCandidates": 6,
        "truncated": false
      },
      "structuralAnalysis": {
        "analyzedFiles": 6,
        "parserCounts": {
          "@babel/parser": 6
        },
        "confidenceCounts": {
          "high": 5,
          "medium": 1
        },
        "parserFallbacks": 0,
        "fallbackPathGroups": {},
        "diagnosticCount": 1,
        "diagnosticSamples": [
          "index.d.ts: Parser recovered: Missing initializer in const declaration. (155:36)"
        ],
        "changedFileParser": {
          "parser": "@babel/parser",
          "confidence": "high",
          "diagnostics": []
        },
        "resolvedDependencyEdges": 5,
        "staticImportObservations": 15,
        "testFilesClassified": 0
      },
      "assessment": {
        "path": "index.js",
        "language": "javascript",
        "status": "unknown",
        "changedSymbols": [
          "(module scope)"
        ],
        "relatedTests": [],
        "relatedTestShapes": {
          "filenamePattern": 0,
          "directoryOnly": 0
        },
        "impactedFileCount": 3,
        "limitations": [
          "No test-to-change relationship was found; dynamic imports and runtime dispatch may not be visible statically."
        ]
      },
      "relationship": {
        "groundTruthStrength": "clear",
        "expectedTests": [
          "test.js"
        ],
        "foundExpectedTests": [],
        "missedExpectedTests": [
          "test.js"
        ],
        "classification": "clearly-expected-missed",
        "chainValidated": true
      },
      "checks": {
        "expectedIds": [
          "js:test:test"
        ],
        "discoveredIds": [
          "js:test:test"
        ],
        "foundExpectedIds": [
          "js:test:test"
        ],
        "missedExpectedIds": [],
        "targetRunners": [],
        "targetedDefinitions": []
      },
      "reportNotes": [
        "Checks were discovered but not executed. Repository code execution requires explicit --run-checks consent."
      ],
      "trust": {
        "repositoryCodeExecuted": false,
        "statement": "No repository code was executed. Git inspection and language parsing were performed locally."
      }
    },
    {
      "id": "fastify-relative-cjs",
      "repository": "fastify/fastify",
      "commit": "e4ffc205328db294d550c5855d2573b33f5e9d62",
      "changeType": "real-repository-structure+synthetic-no-op",
      "evaluationMode": "static-only",
      "durationMs": 494,
      "inventory": {
        "trackedFiles": 393,
        "manifestTrackedFiles": 393,
        "inventoryFiles": 393,
        "supportedSourceCandidates": 300,
        "truncated": false
      },
      "structuralAnalysis": {
        "analyzedFiles": 300,
        "parserCounts": {
          "@babel/parser": 300
        },
        "confidenceCounts": {
          "high": 300
        },
        "parserFallbacks": 0,
        "fallbackPathGroups": {},
        "diagnosticCount": 0,
        "diagnosticSamples": [],
        "changedFileParser": {
          "parser": "@babel/parser",
          "confidence": "high",
          "diagnostics": []
        },
        "resolvedDependencyEdges": 351,
        "staticImportObservations": 1215,
        "testFilesClassified": 227
      },
      "assessment": {
        "path": "lib/wrap-thenable.js",
        "language": "javascript",
        "status": "unknown",
        "changedSymbols": [
          "(module scope)"
        ],
        "relatedTests": [
          "test/async-dispose.test.js",
          "test/body-limit.test.js",
          "test/build/version.test.js",
          "test/constrained-routes.test.js",
          "test/custom-parser-async.test.js",
          "test/custom-parser.0.test.js",
          "test/custom-parser.1.test.js",
          "test/custom-parser.4.test.js",
          "test/custom-parser.5.test.js",
          "test/diagnostics-channel/404.test.js",
          "test/diagnostics-channel/async-delay-request.test.js",
          "test/diagnostics-channel/async-error-handler.test.js",
          "test/diagnostics-channel/async-request.test.js",
          "test/diagnostics-channel/error-before-handler.test.js",
          "test/diagnostics-channel/error-request.test.js",
          "test/diagnostics-channel/sync-delay-request.test.js",
          "test/diagnostics-channel/sync-request-reply.test.js",
          "test/diagnostics-channel/sync-request.test.js",
          "test/esm/errorCodes.test.mjs",
          "test/esm/esm.test.mjs",
          "test/esm/index.test.js",
          "test/esm/named-exports.mjs",
          "test/hooks-async.test.js",
          "test/hooks.on-listen.test.js",
          "test/hooks.on-ready.test.js",
          "test/http-methods/copy.test.js",
          "test/http-methods/custom-http-methods.test.js",
          "test/http-methods/get.test.js",
          "test/http-methods/head.test.js",
          "test/http-methods/lock.test.js",
          "test/http-methods/mkcalendar.test.js",
          "test/http-methods/report.test.js",
          "test/http-methods/search.test.js",
          "test/http-methods/trace.test.js",
          "test/http-methods/unlock.test.js",
          "test/internals/content-type-parser.test.js",
          "test/internals/handle-request.test.js",
          "test/internals/hooks.test.js",
          "test/internals/reply-serialize.test.js",
          "test/internals/reply.test.js",
          "test/internals/request-validate.test.js",
          "test/internals/schema-controller-perf.test.js",
          "test/internals/server.test.js",
          "test/issue-4959.test.js",
          "test/listen.4.test.js",
          "test/listen.5.test.js",
          "test/logger/instantiation.test.js",
          "test/logger/logging.test.js",
          "test/logger/options.test.js",
          "test/logger/request.test.js",
          "test/logger/response.test.js",
          "test/plugin.1.test.js",
          "test/plugin.2.test.js",
          "test/plugin.3.test.js",
          "test/plugin.4.test.js",
          "test/route.2.test.js",
          "test/serialize-response.test.js",
          "test/skip-reply-send.test.js",
          "test/stream-serializers.test.js",
          "test/stream.1.test.js",
          "test/types/content-type-parser.tst.ts",
          "test/types/decorate-request-reply.tst.ts",
          "test/types/dummy-plugin.mts",
          "test/types/errors.tst.ts",
          "test/types/fastify.tst.ts",
          "test/types/hooks.tst.ts",
          "test/types/instance.tst.ts",
          "test/types/logger.tst.ts",
          "test/types/plugin.tst.ts",
          "test/types/register.tst.ts",
          "test/types/reply.tst.ts",
          "test/types/request.tst.ts",
          "test/types/route.tst.ts",
          "test/types/schema.tst.ts",
          "test/types/serverFactory.tst.ts",
          "test/types/type-provider.tst.ts",
          "test/types/using.tst.ts",
          "test/web-api.test.js",
          "test/wrap-thenable.test.js"
        ],
        "relatedTestShapes": {
          "filenamePattern": 61,
          "directoryOnly": 18
        },
        "impactedFileCount": 107,
        "limitations": [
          "Related test files were found statically, but no recognized runner was observed executing them successfully."
        ]
      },
      "relationship": {
        "groundTruthStrength": "clear",
        "expectedTests": [
          "test/wrap-thenable.test.js"
        ],
        "foundExpectedTests": [
          "test/wrap-thenable.test.js"
        ],
        "missedExpectedTests": [],
        "classification": "clearly-expected-found",
        "chainValidated": true
      },
      "checks": {
        "expectedIds": [
          "js:lint:lint",
          "js:test:test",
          "js:test:test:ci"
        ],
        "discoveredIds": [
          "js:lint:lint",
          "js:test:test",
          "js:test:test:ci"
        ],
        "foundExpectedIds": [
          "js:lint:lint",
          "js:test:test",
          "js:test:test:ci"
        ],
        "missedExpectedIds": [],
        "targetRunners": [],
        "targetedDefinitions": []
      },
      "reportNotes": [
        "Checks were discovered but not executed. Repository code execution requires explicit --run-checks consent."
      ],
      "trust": {
        "repositoryCodeExecuted": false,
        "statement": "No repository code was executed. Git inspection and language parsing were performed locally."
      }
    },
    {
      "id": "zod-package-self-export",
      "repository": "colinhacks/zod",
      "commit": "2d90846af918af9602e088812d63a035d47cdbe4",
      "changeType": "real-repository-structure+synthetic-no-op",
      "evaluationMode": "static-only",
      "durationMs": 522,
      "inventory": {
        "trackedFiles": 584,
        "manifestTrackedFiles": 584,
        "inventoryFiles": 584,
        "supportedSourceCandidates": 410,
        "truncated": false
      },
      "structuralAnalysis": {
        "analyzedFiles": 410,
        "parserCounts": {
          "@babel/parser": 410
        },
        "confidenceCounts": {
          "high": 410
        },
        "parserFallbacks": 0,
        "fallbackPathGroups": {},
        "diagnosticCount": 0,